ben weer blij met me nieuwe kleding zwart vestje een esprit trui en een geisha tuniekje Hihi,+
Jeuj eerste werkdag Esprit en nu al een roosje gekregen,+
G Star staakt zandstralen Levis H M C A en Esprit deden het al niet meer nu stoppen ook G Star en WE met het http bit ly eSux2I,=
ik wil een sneeuwfoto van mij en esprit,=
OneForHer Esprit Horloge Met 50 Korting E42 50 http www hear nl out deal 402634,=
Dagaanbieding OneDayForHer Esprit horloge met 50 korting voor 42 50 http bit ly fl2vQf,=
Zilveren Esprit Creolen oorbellen http bit ly eANdDo iDiva,=
Esprit horloge met 50 korting De horlogs uit de Mila serie zijn verfijnd dagaanbieding van 85 00 voor 42 50 http www twigle nl 81,=
iDiva Zilveren Esprit Creolen Oorbellen E24 95 http www hear nl out deal 402670,=
Ik droomde net dat esprit in mn schuur stond,=
K wil naar esprit,+
ff op esprit kijken ofdat er nog wat leuk is,=
Net 2 broeken bij esprit gekocht,=
Werken @ Esprit,=
okee dus ik ga stage lopen bij ah hema esprit,=
damnnn ben die esprit 10euro kortingscode kwijt ! heeft iemand hem toevallig nog liggen of in een mailtje staan ?,-
zonnetje straks in mijn pauze lekker naar buiten stukje lopen eventjes naar esprit voor schoentjes naar de hema .,+
tuttebellas veiling ! ! ! nieuwe esprit sandaaltjes bieden vanaf 2 50 euro ! bieding loopt tot 9 : 30 uur ! media id=1203941089o6d0 size=large,=
thuis leiden thuis blij met de buggypod voor  gegeten bij shabu shabu  en nu mn esprit pakketje uitpakken,+
esprit morgen 1e dagje sinds 3 weken weer proberen te werken !,=
suikerzoete kleuren bij esprit . fel en pastel . geen porto . http : //www . gezinonline . nl/espritkinderkledingdameskledingherenkleding . htm,=
lekker weg iedereen bedankt voor de felicitaties ! leuke dag gehad in alkmaar . heerlijk geshopt goed geslaagd bij esprit schoenen en laarzen . heerlijk op terasje gezeten en heel lekker gegeten . al met al zeer geslaagde dag met mijn grote liefde,+
shoppen op esprit . nl a,=
ff bubbeltjes in de stad #succesmoetjevieren @ caffe esprit pic  //4sq . com/hxs1y5,+
cindy  zw . parka jacapuchon merk esprit en inhoud : nokia e72 ode portemonnee en blauw/grijze handschoenen,+
rdam cs leuk lentejurkje besteld in de esprit eshop nu hopen dat hij goed past . zo de trein in naar utrecht om uit eten te gaan met de meiden !,=
vandaag nieuw t shirt van Esprit gekocht,=
We hebben Esprit kussens bij de kruidvat beter zijn die er zaterdag niet meer,=
Halfjaarcijfers Esprit groeimarkt China kost winst Esprit doet het goed in China Tevens kondigt de mode inter http bit ly g5rdBw,+
Krijg je mailtje van esprit zwart is uit noubedankt,=
Rue de la plume in Alkmaar Heerlijk gegeten met alle Esprit girls en Thom,+
10 jaar bij Esprit Net n prachtige bos bloemen gehad cd baas,+
thuis grote nieuwe kindermerkkleding verkoop in heiloo 13 maart van 11 . 0018 . 00 zondag 13 maart houden wij een grote verkoop van nieuwe kindermerkkleding . we verkopen kinderkleding in de maten 56tm176 voor jongens en meiden van oa de merken barbara farber nono vingino protest geisha isla ibiza blue pepper mexx esprit enz . enz . babykleding 5 euro kinderkleding vanaf maat 92 10 euro ook aantal kinderschoenen en kleine collectie herenkleding apart geprijsd voor meer info kunt u de adverteerder emailen .,=
my life  vrijdag  vanaf es naar huis naar esprit zondag : brak naar heemskerk,=
my life vandaag  school tot 1 naar esprit . donderdag  school tot 2 naar esprit naar daniella toe ? naar es ? naar sens ? bij es pitten ? zaterdag  brakdag,=
esprit hengelo bijna klaar op school,=
sinds donderdag open voor de dames de nieuwe outlet van esprit bij de arena in adam http : //t . co/6ukioy3,=
home sweet home gister heerlijk tapas gegeten met mn collegas vanmorgen weer gezellig naar de mart geweest  straks met de kinderen maar weer even lekker naar buiten ondertussen aan het wachten op mn pakket van esprit,+
vandaag een dagje hard werken aan school maar ik had zon om te winkelen dus heb ik in mijn pauze me uitgeleefd op esprit . com : d lang leven het online shoppen !,+
cruquius thuis huis fynn net nog even de laatste koopjes weggehaald bij topshelf . grote sport en gewone merkkleding in cruquius . 5 stuks merkkleding guess esprit gant enz . halen 2 betalen jaja dat is leuk kopen . ook kados gekocht voor zoon fynn die maandag 30 wordt en vanavond feest geeft .,+
esprit eindelijk geslaagd voor een outfit voor de doop van phileine . . .,+
esprit is voor mij een fijn merk,+
esprit heeft nu nieuwe lentemode !,=
net wat bij esprit gekocht en nu al kapot ! slecht bagger,-
