1,1,0,0,3,2,1,2, ,goed, ,2,1,2,1,1,1,Zit fantastisch!!,Staat geweldig en zat bij mijn zoon geweldig!,Zit fantastisch en gaat lang mee!,Zit leuk!,"Ook hele mooie kleding, zit leuk!",2,2,1,2,Heb ik nog neit mee gespeeld! Maar hoorde posieve dingen.,Fantastisch!,Heel mooi spellenapparaat!,2,2,3,4,3,3,Ik vind dat hij ook veel goede dingen he, , , , ,"703,315",14-Feb-2011 17:09:28,2,05-Mar-1954,57,6,5,5,3,5,"3,813",10
1,0,0,0,5,3,3,3, , , ,4,3,3,2,3,3, , , , , ,2,2,1,2, , , ,4,5,3,2,2,3, , , , , ,"611,487",14-Feb-2011 19:11:36,1,05-Sep-1976,34,6,5,2,5,5,"2,987",12
0,0,0,1,2,2,2,3,een goede engelse ploeg,komt uit spanje en hebben goede spelers,italiaanse ploeg,4,3,3,3,3,3,ken ik alleen van naam,ken ik alleen van naam,ken de naam verder niets mee,naamsbekendheid,ken ik van naam,4,6,6,6, , , ,5,6,6,6,6,6, , , , , ,"745,560",14-Feb-2011 17:11:02,2,28-Oct-1955,55,6,1,5,3,6,"5,071",7
1,1,0,0,2,2,2,2, , , ,2,2,2,2,2,2, , , , , ,4,3,2,3, , , ,2,2,3,2,3,2, , , , , ,"613,331",14-Feb-2011 18:01:52,2,20-May-1948,62,6,8,3,5,5,"1,827",8
1,0,0,0,5,6,6,6, , , ,3,1,6,6,2,2,degelijk en blijft goed in pasvorm, , ,zit lekker,leuk en zit goed,5,6,6,6, , , ,3,4,3,5,2,3,te  negatief,bjzondere man,veel te negatief Zit altijd te hakkentak, , ,"805,262",14-Feb-2011 20:10:49,2,30-Jul-1947,63,2,1,5,4,5,"9,942",3
1,0,0,0,4,6,6,6, , , ,3,6,6,2,6,1,nooit gekocht,nooit gekocht,goede kwaliteit,nooit gekocht,leuke kleding,5,6,6,6,heb ik niet,heb ik niet,heb ik niet,4,6,6,6,6,6, , , , , ,"139,794",14-Feb-2011 18:54:31,2,17-Sep-1966,44,6,5,2,3,2,"6,081",6
0,0,0,1,5,5,5,5,het is altijd ruzie tijdens het voetbal,Het is altijd ruzie tijdens het voetbal,het is altijd ruzie tijdens het voetballen,5,6,6,6,6,6,Bemoei mij niet met mijn kleding, , , , ,5,6,6,6,doe geen computer speltjes, , ,1,5,5,2,5,2,Zo snel mogelijk weg,Weg met dit Kabinet,Goed voor de Partij,Dit isvoor het kapitaal weg er mee,Goed voor GroenLinks,"890,564",14-Feb-2011 17:54:01,1,23-Oct-1947,63,2,4,6,2,5,"4,872",7
0,1,0,0,3,2,1,3,"Wat onzichtbaar dit seizoen, maar veel glorie",De topclub van het moment,Speelt nog CL. maar verder niet gezien,4,2,3,2,3,3,Tenminste spannende reclame, ,Valt op, , ,4,3,3,3, , , ,2,5,3,3,4,2,"Ja, ach ....",Bleek op BuZa,Gemiste kans?,"Wel liberaal, nooit eigen baas geweest",Eeerste belangrijke hindernis vlot genom,"783,704",14-Feb-2011 20:13:15,1,05-May-1959,51,8,6,2,4,6,"2,291",12
1,1,1,0,3,6,6,6, , , ,5,2,2,2,1,1,uit advertenties,marketing,bekendheid,gebruik,gebruik,5,6,6,6, , , ,1,5,3,2,1,1,discriminatie,geef hem een kans,echte pvda-er,"nieuwe leider, nieuwe kansen","nieuwe leider, nieuwe kanse","797,358",15-Feb-2011 14:19:08,1,25-May-1974,36,6,5,2,5,6,"7,574",9
1,0,1,0,4,6,6,6, , , ,2,4,4,3,2,1,saaie onderbroeken,"kinderachtig, duur, drukke prints",sportief,"netjes, voor naar het werk","trendy, fijne website, kleding zit goed",2,2,2,4,mooi systeem maar weinig leuke spellen voor vrouwen,"lijkt me leuk, actief",echt voor mannen,2,2,6,5,1,5,"opvallend, maar niet altijd tactisch", ,te links,"slim, diplomatiek, leuk",te links,"146,742",14-Feb-2011 17:55:24,2,26-Apr-1981,29,8,5,2,5,5,"3,137",12
0,0,0,1,4,1,1,2,Degelijke club,Degelijke club,Berlusconi???,4,6,6,2,6,6,ken ik niet,ken ik niet,Vertrouwd,ken ik niet,ken ik niet,5,6,6,6,ken alleen de naam,ken alleen de naam,ken alleen de naam,1,5,4,2,2,4,Zou geen politicus mogen heten is opruie,Slecht gehandeld inzake iraanse,Wordt steeds beter,Goede leider maar luister niet genoeg,Heeft lak aan de mensen,"1,680,150",14-Feb-2011 18:40:08,1,17-Mar-1947,64,1,6,6,4,5,"3,333",12
0,1,0,0,5,6,6,6, , , ,5,6,6,6,6,6, , , , , ,5,6,6,6, , , ,2,5,4,2,2,2, , , , , ,"124,732",14-Feb-2011 19:13:07,2,13-Jan-1948,63,4,8,4,6,5,"2,743",12
0,0,0,1,1,2,2,2,Van der Sar he. Boegbeeld !,"Messi en Vorki, goed koppel.","Oude tijden, goede tijden.",2,6,3,3,3,3,Ken ik niet, , , , ,5,6,6,6, , , ,2,2,3,5,1,3,Wordt ten onrechte in de nazi-hoek gedru,"Te slap, te beleefd",Kan beter een andere baan zoeken,Doet het beter dan verwacht,"Geen hoogvlieger, maar wel met lef","66,768",15-Feb-2011 09:14:17,1,03-Nov-1935,75,3,6,6,5,5,"1,326",4
0,1,0,0,5,6,6,6,"ik hou niet van voetbal, heb ik in de vorige vraag al gezegd", , ,5,6,6,6,6,6,zie vorige antwoord., , , , ,4,4,1,5,"grafisch goed, maar te duur","leuk en onderhoudende spellen, wel simpel",zie ps3,5,6,6,6,6,6,zie antwoord vraag 1 en 2., , , , ,"2,025,792",16-Feb-2011 07:18:02,1,02-Jan-1970,41,7,4,2,4,5,"5,628",7
0,0,0,1,5,6,6,6, , , ,5,6,6,6,6,6, , , , , ,5,6,6,6, , , ,1,3,4,5,2,4, ,ongelukkig optreden,zeer stuntelig,doet het goed met zijn minderheidskabine,instemming met missie ondanks groot verz,"2,021,609",15-Feb-2011 15:38:27,1,27-Dec-1939,71,3,6,6,4,5,"5,283",7
0,0,0,1,5,6,6,6, , , ,4,6,6,6,6,6, , , , , ,5,6,6,6, , , ,5,4,5,3,3,4, , , , , ,"112,784",14-Feb-2011 17:36:47,2,04-Jul-1955,55,2,2,4,3,5,"6,444",6
1,1,0,0,5,6,2,6, ,heb kennissen in barcelona, ,5,6,6,6,6,6, , , , , ,5,6,6,6, , , ,5,6,6,6,6,6, , , , , ,"81,074",14-Feb-2011 17:35:33,2,22-Jun-1963,47,3,8,5,6,6,"1,312",4
0,0,0,1,2,2,1,2,Goede club,Fantastisch spel,Band met Nederlandse spelers,4,6,3,2,3,3,Ondergoed?,Mwah,Aardig merk,Geen binding mee,Ooko geen binding mee,5,6,6,6,Nog nooit mee gespeeld,Nog nooit mee gespeeld,Nog nooit mee gespeeld,2,3,3,1,3,2,Merkwaardige man,Grijze muis,Pientere vent,'t Blijft VVD,Pittige dame,"91,714",14-Feb-2011 21:50:51,1,22-Feb-1951,60,4,6,2,4,6,"8,016",9
1,0,0,0,5,6,6,6, , , ,5,6,6,6,6,6, , , , , ,3,6,6,6, , , ,5,5,4,4,4,4, , , , , ,"57,558",14-Feb-2011 20:04:41,1,11-Jun-1974,36,7,8,2,6,6,"9,933",3
1,1,1,0,3,2,1,3,Degelijk en professioneel,"Dynamisch, passioneel",Gedegen,3,3,3,3,3,3, , , , , ,5,3,3,3, , , ,1,4,3,3,1,2,Drammer,Vakman,Naieve idealist,Realistich en gedreven,Eerlijk,"685,260",14-Feb-2011 18:29:22,1,27-Nov-1954,56,7,7,3,5,5,"2,134",8
0,0,0,1,4,6,3,5,Ken ik alleen va naam,Weet dat hier cruijf in participeert,Is van Berlisconi en dat is een facist,4,2,6,2,2,2,Weet dat dat goed ondergoed is.,Nooit van gehoord,Heeft een goede naam.,Heeft een goede naam.,Heeft een goede naam.,5,3,6,6,"Goed mer, maar hou niet van die zaken",Nooit van gehoord,Nooit van gehoord,1,5,4,1,2,2,"Slecht mens, die haat zaait.",Kan het als minister niet.,Princieel en eerlijk mens.,Kan het als premier met slecht beleid,Vakvrouw,"116,406",14-Feb-2011 17:29:19,1,28-Jun-1937,73,6,7,6,4,5,"5,611",7
0,1,1,0,1,2,1,2,al decennia aan de top met dezelfde coach,veel zelf opgeleide spelers,"iets te oud qua spelersmateriaal, moet verjongen",3,4,2,2,2,2, , , , , ,5,6,6,6, , , ,1,5,4,2,4,1,enge man met fascistische ideeen,"oude man, geen enkele sprankeling","blijft eerlijk, maar dat mag blijkbaar n","streber, geen premier van alle nederland","inspirerende persoon, kan goed debattere","200,533",14-Feb-2011 18:40:27,1,14-Oct-1948,62,4,7,2,5,6,"1,945",8
0,0,0,1,2,2,1,2,goed Engels voetbal,"zeer goed elftal, attractief","typisch IItaliaans, frivool",4,3,2,2,2,3,geen,geen, , , ,5,2,2,2, , , ,2,2,4,4,1,2, , , , , ,"579,159",15-Feb-2011 08:08:55,1,28-Nov-1936,74,7,7,6,5,2,"3,511",10
0,0,0,1,1,1,1,1,speelt op hoog niveau,"prachtige club, ben er geweest","speelt op hoog niveau, bekend van Nederlandse topspelers",2,1,3,2,1,1,kwaliteitsondergoed,ken ik niet zo goed,goed sportmerk,goede kwaliteit,mooi en goed,5,3,2,3,ken ik alleen van naam,bewegen is altijd goed,ken ik niet,2,4,3,2,2,2,veel te extreem in zijn oordelen,ken ik niet zo goed,prettige sociale politicus,hij doet het goed,dapper om Femke Halsema op te volgen,"750,477",15-Feb-2011 21:54:21,2,21-Nov-1948,62,7,5,2,6,3,"7,595",9
1,0,0,0,4,3,3,3, , , ,4,6,6,6,6,6, , , , , ,4,6,2,6, ,bezit er zelf een., ,3,5,5,3,5,4,vernielt de maatschappij,schijnheilige,niet slim genoeg,steelt van de armen,moet terug naar school voor maatschappij,"2,008,152",15-Feb-2011 00:34:24,1,30-Aug-1944,66,2,4,6,6,5,"5,301",2
0,0,0,1,2,2,4,2,geschiedenis en supporters bekende voetballers en naarbehore,popieclub. Ze trekken de grote namen ze maken furore,van ouds tussen de goeien,3,6,5,2,2,6,het is me niet bekend,veel te aandachttrekker populair tussen de jeugd,vertrouwd vaak gekocht,bekend in de gehele wereld,vrouwenmerk,5,6,6,6,niet geinteresserd,niet genteresserd,onbekend,1,5,6,2,5,3,populistisch,onbekend,vriendelijk,vals,ambitieus,"1,755,717",14-Feb-2011 17:06:44,1,06-Nov-1959,51,8,2,3,2,2,"8,454",5
0,1,0,0,3,2,1,1,voor 'n britseclub doen ze 't prima,"top club van de wereld, al jaren",topclub inn Europa. Al jaren,4,2,6,2,6,6,zit lekker, ,lopen prima, , ,5,6,6,6, , , ,2,4,4,4,1,1,te veel onderbuik,te weinig netwerk voor leiding BZ,te ouderwets.'singt'niet,inhoudelijk keigoed en verfrissend,inhoudelijk super en moedig,"1,554,803",15-Feb-2011 10:30:43,1,16-Apr-1947,63,8,3,2,2,5,"6,367",6
1,0,0,0,2,2,2,2,een ploeg die al meerdere jaren goede resultaten boekt,ook een team wat samen sterk s,door namen van bekende nederlanders,2,3,3,2,3,3,geen,geen,draag ik ook meestal kwa kledingen kwaliteit heel goed,geen,geen,4,3,3,3,heb ik niet dus,heb ik niet dus,heb ik niet dus,3,1,3,4,3,4,sta ik ook achter,geen menning over,Is geen leider waar t v stond,moet t nog waarmaken,geen menning,"894,481",15-Feb-2011 22:12:23,2,20-Jun-1960,50,1,3,8,2,2,"3,083",12
1,1,1,0,5,6,6,6, , , ,4,2,6,2,6,6, , , , , ,4,2,2,2, , , ,2,5,2,2,4,2, , , , , ,"127,893",14-Feb-2011 18:14:37,2,28-Jan-1953,58,2,5,2,3,6,"2,804",12
1,1,0,0,2,6,6,6, , , ,1,2,2,2,1,1,draaggemak,is in,goede sportschoenen,goede kleding,goede kleding,2,6,6,6, , , ,1,5,5,2,2,1, , , , , ,"1,094,215",14-Feb-2011 19:57:09,2,13-Aug-1947,63,6,4,4,3,2,"4,876",7
0,0,0,1,5,1,1,1,hou van Engeland,hoor over deze club praten...met bewondering,italiaanse clubs zijn mestal goed,2,2,2,1,2,1,"heb dit gebruikt, bevalt goed",lijkt me goed spul,"gebruik ik zelf, bevalt heel goed",gevoel,"draag ik, fijn spul",3,1,2,2,"van horen zeggen, veel mogelijk",wel eens gedaan,van horen zeggen,4,5,3,2,2,2,vind hem gevaarlijk voor de democratie,"twijfel, reageert niet daadkrachtig geno","straalt vertrouwen uit, goede burgermees","idealistisch, moet kans krijgen",neemt goed over van Femke Halsema,"51,474",15-Feb-2011 12:18:53,2,26-Jun-1954,56,2,4,2,3,2,"3,882",2
0,1,1,0,1,2,1,2,Mooie club,Mooiste club,Mooie club,2,3,2,2,3,3, , , , , ,3,3,2,3, , , ,1,2,4,4,2,3,Hij heet Geert,Iran !!!, ,Nette verschijning en rethoricus,Haaibaai,"117,663",14-Feb-2011 19:48:29,1,04-Jul-1970,40,7,7,8,5,5,"3,284",12
0,1,0,0,3,2,1,1, , , ,4,1,2,2,2,2, , , , , ,5,6,6,6, , , ,1,4,4,1,3,2, , , , , ,"1,466,830",15-Feb-2011 14:50:57,2,09-Feb-1952,59,7,5,2,4,5,"6,881",2
0,0,0,1,3,6,6,6, , , ,5,6,6,6,6,6, , , , , ,5,6,6,6, , , ,2,3,5,2,4,4, , , , , ,"2,024,324",14-Feb-2011 18:34:02,1,09-Feb-1940,71,6,4,6,3,5,"8,071",2
1,0,0,0,2,2,1,3,"Veel geld, beste club van Engeland",Mooiste voetbal in europa/wereld,Grootmacht geweest/Berlusconi,3,2,2,3,6,6,Prettig ondergoed / duurzaam,"Zit lekker, wel wat aan de prijs",niet mijn merk, , ,4,6,2,6, ,Grappige bezigheid, ,3,4,4,3,2,4,Controversieel. Roept makkelijk dingen, ,Beter als burgermeester.,Tot nu toe niet slecht.Lijkt sympathiek,Zwalkende koers,"48,612",15-Feb-2011 07:27:18,1,01-Feb-1964,47,3,7,"99,999",6,5,"1,447",8
1,0,0,0,4,1,1,2,8,9,7,4,2,6,6,6,6,7,-,-,-,-,4,3,6,6,-,-,-,5,4,4,5,3,3,-,-,-,-,-,"41,100",17-Feb-2011 20:09:22,1,15-Feb-1951,60,2,8,2,4,5,"3,354",12
0,0,0,1,5,3,3,3, , , ,2,3,3,3,3,3, , , , , ,5,3,3,3, , , ,1,3,4,3,3,2, , , , , ,"1,339,377",15-Feb-2011 09:54:31,1,26-Mar-1939,71,4,7,6,4,2,"6,418",6
0,0,0,1,3,6,6,6, , , ,4,6,6,6,6,6, , , , , ,5,6,6,6, , , ,3,4,5,3,2,3, , , , , ,"2,025,922",14-Feb-2011 18:36:45,1,15-Oct-1956,54,3,8,2,6,6,"3,208",12
0,0,0,1,3,2,1,2,mooie club oud gediende,mooi voetbal,mooi voetbal,4,6,6,4,6,4,onderbroek,onnozel om je naam te verbinden,onnodig duur,onbekend,onnodig duur,5,6,6,6,geen idee,geen idee,geen idee,2,5,4,3,2,1,rascist populist,geen actie in iran,blijft hangen,weet in elk geval te inspireren,"duidelijk , harde werker goed bezig","65,173",14-Feb-2011 18:05:58,1,07-Mar-1953,58,7,6,3,4,6,"7,731",9
1,1,0,0,5,6,6,6, , , ,3,3,3,2,3,3, , , , , ,5,6,6,6, , , ,2,5,5,3,1,2, , , , , ,"2,023,496",14-Feb-2011 18:02:04,2,10-Dec-1966,44,2,8,8,6,3,"2,435",12
0,0,0,1,5,6,6,6, , , ,4,6,6,6,6,6, , , , , ,3,2,2,2,mogelijkheden,mogelijkheden,mogelijkheden,4,5,4,3,3,2,zaait verdeeldheid,niet altijd duidelijk,redelijk standvastig,moet zich nog bewijzen,goede vervangster Femke,"18,444",16-Feb-2011 10:31:24,1,09-Mar-1963,48,3,5,2,4,2,"2,202",12
1,1,0,0,2,1,1,1,Goed voetbal,Prima voetbal en een beetje nederlands,Ook goed voetbal met ook altijd nederlanders,4,6,3,3,3,3, , , , , ,5,6,6,6, , , ,1,1,3,4,3,2,Recht voor zijn raap,Komt nog niet sterk over,Als burgemeester was hij beter op zijn p,Moet het nog maar waar maken.,Begint goed,"1,972,850",14-Feb-2011 20:23:12,1,04-Sep-1943,67,7,7,6,4,5,"6,605",2
0,0,0,1,4,2,2,3, , ,blasé,4,3,3,3,3,3, , , , , ,4,3,2,3, , , ,2,5,4,2,2,3,verfoeilijke volksmenner,"slecht begonnen, half verloren",eerst denken dan doen!,opportunist,nog even afwachten,"75,652",15-Feb-2011 10:06:21,1,29-Oct-1944,66,4,7,6,4,5,"6,715",2
1,1,0,0,2,3,3,3, , , ,4,3,3,3,3,3, , , , , ,4,6,6,6, , , ,5,6,6,6,6,6, , , , , ,"2,024,552",14-Feb-2011 19:43:17,1,15-Dec-1961,49,6,4,2,3,5,"1,613",8
0,1,0,0,5,6,6,6, , , ,3,6,6,3,3,2, , ,laat me onverschillig,koop ik soms,prettig,5,6,6,6, , , ,1,5,3,2,2,4,egoïstische gek,"goedwillend, onnauwkeurig","prima ideeën, zwak in media","sterke pesoonlijkheid, weinig inhoud","Wil goed (hoop ik), laat zich meeslepen.","185,206",14-Feb-2011 19:12:42,2,15-Nov-1941,69,4,4,6,4,5,"4,054",2
0,1,0,0,5,6,6,6, , , ,2,2,2,2,2,2, , , , , ,5,6,6,6, , , ,2,1,2,5,1,2, , ,praatjes maker, , ,"687,692",14-Feb-2011 17:15:48,1,02-Aug-1934,76,6,8,6,4,2,"5,831",7
1,1,0,0,1,2,2,2,"engels voetbal, doorgaan tot......",creatief,mooi,4,3,3,2,3,3, , , , , ,4,3,2,3, , , ,2,4,3,4,2,2, , , , , ,"1,948,406",14-Feb-2011 17:40:55,1,14-Mar-1944,67,2,6,6,3,5,"3,823",10
1,0,1,0,5,6,6,6, , , ,4,2,6,4,6,3,"fijn ondergoed, wel (te) duur", ,te commercieel, , ,5,6,2,6, ,wel leuke dingen van gezien, ,3,5,6,2,3,3,"Wilders moet uit politiek, wat een... ..", ,sympathiek, , ,"145,083",15-Feb-2011 17:20:45,2,07-Apr-1955,55,7,8,3,4,5,"1,056",8
1,0,0,0,2,2,1,1,nee,nee,nee,5,6,6,6,6,6,nee,nee,nee,nee,nee,5,6,6,6,nee,nee,nee,2,4,5,2,3,2,nee,nee,nee,nee,nee,"144,006",15-Feb-2011 21:37:33,1,10-Jan-1952,59,6,7,2,4,5,"4,761",7
0,0,0,1,2,2,1,1, , , ,4,2,2,1,3,3, , , , , ,5,3,3,3, , , ,1,5,4,2,2,1, , , , , ,"101,075",15-Feb-2011 14:47:27,1,05-Apr-1946,64,8,7,3,4,5,"1,019",8
0,0,0,1,3,6,6,6,Ik kijk nooit naar voetballen, , ,5,2,6,6,6,6, , , , , ,5,6,6,6, , , ,2,2,2,5,1,3,"Kundig politiekus, met eigen ideeën",Doet zijn best moet er nog ingroeien,"Flapdrol, gezellige oude opa","Groot politiek inzicht, zeer kundig",moet zich nog waar maken,"177,948",15-Feb-2011 12:18:46,1,25-Aug-1943,67,7,7,6,4,5,"7,101",2
0,0,0,1,2,2,2,2, ,van horen zeggen,van horen zeggen,1,4,3,3,1,1,niets bijzonders,"gaat wel, ook niet bijzonder","gaat wel, niet beter dan andere merken","zit vrijwel altijd goed, ontwerp neutraal","mooie ontwerpen, past mooi",3,3,2,3, , , ,2,5,4,3,2,1,"3 x niks, lult maar wat","aanvankelijk OK, maar valt tegen als min",hoop nog steeds dat hij zich beter profi,"een meeballer, beter dan verwacht","helder, duidelijk, weet wat ze doet.","2,015,740",14-Feb-2011 17:07:56,2,25-Sep-1946,64,7,6,6,3,2,"6,523",2
1,1,1,0,1,1,1,2,Superclub met superspelers,Beste club ter wereld op het moment,Goede club met vage bestuurders,2,3,3,3,2,2,Onderbroekenmerk,Te dure kleding,Goede stevig sportmerk,Net merk,Net merk,1,2,1,2,Grafisch sterke console,Vooral fun!,Goede computer,2,2,2,3,1,2,Brengt de discussie los,Stabiele man die fouten toegeeft,Onbetrouwbare kerel,Stabiele leider,Onwennig mediafiguur,"35,988",17-Feb-2011 12:10:51,1,11-Dec-1983,27,1,"99,999",1,"99,999","99,999","5,704",7
0,0,0,1,2,1,1,3,vd Sar!!!!!,het mooiste voetbal, ,4,2,3,3,4,4,nuttig spul,niet mijn stijl,ik ben niet sportief,vodderig,past me niet,5,6,6,6, , , ,1,5,4,2,2,2,hang him,politiek onbenul,hij deugt,doet het goed,ze komt er wel,"1,598,337",14-Feb-2011 22:12:17,2,22-Jan-1948,63,7,7,6,5,2,"1,106",8
1,1,1,0,5,6,6,6,ben geen voetbalfan, , ,2,3,2,2,2,2,gewone niets bijzonders,"zit lekker, goede kwaliteit",mooie sportkleding,prima kleding,soms wat klein van maat,5,3,3,3, , , ,3,5,3,3,2,1,haatzaaier,ken ik niet goed,soms een beetje slap,komt sterk en duidelijk over,vrouw met ballen,"2,016,145",14-Feb-2011 20:58:16,2,14-Oct-1977,33,6,6,2,4,2,"3,039",12
0,1,0,0,4,6,6,6, , , ,3,6,2,2,6,2, ,degelijke producten,de producten zijn zover ik weet van goede kwaliteit, ,leuke kleding,3,2,1,2,volgens vrienden is dit een goed merk,deze hebben we zelf en de spellen zijn erg leuk,hier heb ik ook alleen maar goeds van gehoord,2,5,6,2,3,2,ik ben het niet eens met zijn ideeën, ,heeft een goede indruk achtergelaten,hij probeert en bedoelt het goed,zij moet zich nog bewijzen na Halsema,"180,955",21-Feb-2011 16:49:39,2,27-Aug-1989,21,4,2,1,3,1,"6,092",6
1,1,0,0,5,6,6,6,ken ik niet,ken ik niet,ken ik ook niet,5,6,6,6,6,6,zegt mij niets,zegt mij niets,zegt mij niets,zegt mij niets,zegt mij niets,4,3,2,6, , , ,1,4,2,1,1,3,"grote mond, geen resultaat", , , , ,"1,028,441",14-Feb-2011 19:32:20,1,03-Sep-1953,57,3,8,5,6,6,"7,009",2
0,0,0,1,3,6,6,2, , , ,1,1,2,2,3,1,goede pasvorm,obv beeld,obv beeld, ,"basiskleding, goede pasvorm betaalbaar",4,6,2,2, ,wel leuk om eens te doen,idem,2,4,3,2,3,2, , , , , ,"1,262,214",14-Feb-2011 19:32:33,2,17-Oct-1967,43,7,5,2,5,6,"4,761",7
1,0,0,0,4,6,6,6,NEE,NEE,NEE,4,2,6,6,6,6,is goed,nee,nee,nee,nee,3,6,6,6,nee,nee,nee,5,6,6,6,6,6,nee,nee,nee,nee,nee,"182,949",15-Feb-2011 10:24:43,2,30-Jul-1951,59,6,3,5,2,5,"9,628",3
0,0,0,1,5,6,6,6, , , ,5,1,3,3,3,3,bevalt goed, , , , ,5,6,6,6, , , ,2,5,3,4,2,2, , , , , ,"134,065",18-Feb-2011 12:46:58,1,22-Feb-1948,63,8,6,2,5,5,"5,224",7
1,1,0,0,1,3,1,2,geen interesse Engels voetbal,Mooi voetbal,favoriete Italiaanse club,4,3,3,3,3,3, , , , , ,3,3,1,3, , , ,1,5,3,4,1,3, , , , , ,"1,539",15-Feb-2011 10:42:04,1,01-Jul-1959,51,6,4,"99,999","99,999","99,999","7,482",9
0,0,1,0,5,6,6,6,ik ben niet geïnteresseerd in voetbal,ik ben niet geïnteresseerd in voetbal,ik ben niet geïnteresseerd in voetbal,4,6,6,6,6,6, , , , , ,3,3,2,3,geen ervaring mee,beetje (positieve) ervaring mee,geen ervaring mee,2,5,5,2,3,2,zijn overtuigingen zijn niet de mijne,idem,bedoelt het goed maar komt niet sterk ov,idem als GW/UR maar brengt het leuker;-),sterke vrouw,"1,080,982",15-Feb-2011 08:34:19,2,26-Feb-1955,56,7,8,3,6,5,"2,245",12
1,1,0,0,3,6,6,6,geen idee,geen idee,geen idee,2,3,2,4,2,2,"voldoende maten, jammer dat ze vaak te strak zitten",duur,maten kloppen niet met werkelijkheid, , ,1,6,1,6, , , ,5,4,4,3,3,3, , , , , ,"75,666",15-Feb-2011 10:42:03,2,23-Oct-1976,34,3,5,2,3,5,"1,445",8
0,0,0,1,2,2,1,2, ,fantastisch voetbal, ,4,2,2,3,3,3, , , , , ,4,3,2,3, , , ,2,5,4,2,2,2,wijt problemen aan minderheden,weinig overtuigend in handelen,"integer, samenbindend",goede presentatie,knap debuut,"169,218",14-Feb-2011 20:42:33,1,14-Nov-1941,69,7,7,6,4,5,"7,414",9
1,1,0,0,4,2,2,1,"goed team, altijd geweest - supporters zijn niet allemaal zo","Goede team, kopen goede spelers, directie en fans soms te fa","Mooie team, goede resultaten, meestal heren op het veld. Fan",3,3,4,2,3,1,Beetje duur voor saaie oudewetse ondergoed,Duur en niet comfortabel,"leuk, comfortabel, duur (maar het waard) - kleuren zijn soms",Duur en niets bijzonder,Leuk geprijst - iets voor iedereen goed merk,5,6,6,6, , , ,1,5,5,4,5,5,weing goeds,slecht begin,"druiloor, onzichtbaar",yuppi jongen met snelle auto,Breng Femke terug,"62,217",14-Feb-2011 20:03:49,2,22-Nov-1950,60,7,3,2,4,5,"3,905",10
0,1,0,0,3,3,3,3, , , ,4,4,5,2,2,2, , , , , ,3,2,1,2, , , ,1,5,4,2,4,4, , , , , ,"1,742,376",14-Feb-2011 17:32:08,2,09-Jul-1991,19,3,2,1,2,1,"2,313",12
0,0,0,1,3,3,3,3,te dure aankopen en veel schuld,idem,idem,2,2,4,2,2,1,redelijk spul als je het maar niet in de droger gooit,"prijs kwaliteit;waardeloos. vaart op naam, wel knap", , ,niet te duur en toch leuk,5,6,6,6, , , ,2,4,3,4,2,3,te veel van alles!,moet er nog inkomen,WIL ER TE GRAAG INKOMEN,POPI JOPI,KNAP HOE ZE UIT DE URUZGAN KWESTIE IS GE,"2,025,064",14-Feb-2011 19:05:18,2,09-Nov-1961,49,3,1,4,5,6,"5,504",7
1,1,0,0,5,1,1,1, , , ,2,3,2,2,1,2, , , , , ,5,2,1,2, , , ,4,3,2,4,2,3, , , , , ,"103,390",14-Feb-2011 17:56:18,2,17-Apr-1966,44,6,5,2,4,2,"2,021",8
0,1,0,0,2,2,1,2,"Rooney, van der Sar","prachtig samenspel,Messi",Nederlandse bijdrage van oudsher,3,6,6,6,6,6, , , , , ,5,6,6,6, , , ,1,5,4,2,2,1,blaaskaak,glibbert,betrouwbaar,"joviaal, iets té",krachtig en eerlijk,"115,256",14-Feb-2011 18:21:46,1,26-Aug-1935,75,8,7,6,4,5,"1,016",8
1,0,0,0,3,6,6,6, , , ,3,3,3,3,1,1,prima prijs kwaliteit,grappige dessins/kleuren,prima voor sportkleding,leuke kleding die prima voor werk is,goede kwaliteit/prijs,4,6,2,6, ,interactief, ,3,3,3,2,2,2, , , , , ,"592,118",15-Feb-2011 19:14:05,2,10-Aug-1973,37,7,5,2,4,6,"3,351",12
1,0,0,0,1,1,1,2, , , ,4,6,6,6,6,6, , , , , ,5,6,6,6, , , ,3,1,2,5,1,3, , , , , ,"67,038",14-Feb-2011 17:04:27,1,03-Nov-1941,69,6,5,6,4,5,"2,114",8
0,0,0,1,4,4,3,4,zeer foute onderneming,foute onderneming,zeer foute onderneming,5,3,3,3,2,2,te duur,te duur,te duur,te duur,te duur,5,4,3,4, , , ,4,5,4,2,5,5,limburgse bruinhemd,jood,goede jood,werd op school gepest,amerikaanse agent,"2,023,267",15-Feb-2011 11:08:54,1,09-Nov-1944,66,7,7,8,5,5,"9,649",3
1,1,0,0,2,2,2,2, , , ,2,3,1,2,2,1,degelijk,Stoer &amp;  sportief,Sportief,duur,"Goede kleding, prijs kwalteit verhouding is prima!",5,1,1,1, , , ,5,4,6,4,1,6,rare man,Ken ik bijna niet,rare man,Prima vent,Ken ik bijna niet,"196,816",16-Feb-2011 21:49:56,2,18-Jun-1973,37,7,4,2,4,6,"1,827",8
0,1,0,0,5,6,6,6, , , ,2,2,6,2,2,2,goed materiaal en 'vormgeving',geen ervaring,goed materiaal,goede kwaliteit,"goede kwaliteit, modieus",5,6,6,6, , , ,4,5,3,4,3,3, , , , , ,"75,493",14-Feb-2011 23:03:28,2,08-Oct-1948,62,3,3,2,4,5,"1,215",8
1,1,1,0,1,1,1,3,snel spel,mooi technisch voetbal,beetje op achtergrond geraakt,2,1,4,2,2,2,zit lekker,vreselijk lelijke kleuren,redelijk mooie outfits,mooie pasvorm,eigentijds,3,2,2,2,mooie grafics,actief meedoen,mooie snelle spellen,4,3,4,4,3,3,heeft eigen mening,zeer stuntelig nietszeggend persoon,sulletje,net jongetje,geen sterke persoonlijkheid,"134,195",14-Feb-2011 22:20:40,1,15-Aug-1960,50,7,6,2,4,6,"5,271",7
0,0,0,1,1,1,1,2, , , ,4,6,6,6,6,6, , , , , ,5,6,6,6, , , ,1,3,3,4,1,2, , , , , ,"196,172",15-Feb-2011 15:44:45,1,19-Jun-1924,86,7,7,6,4,5,"2,015",8
0,1,1,0,2,3,3,3,-,-,-,4,3,3,3,3,3,-,duur,duur,-,duur,5,3,3,3,-,-,-,2,5,6,3,2,6,geen mening,-,-,doet het boven verwachting,-,"2,684",14-Feb-2011 17:49:37,1,05-Mar-1973,38,7,7,2,4,1,"7,255",2
1,0,0,0,4,6,6,6, , , ,4,6,6,6,6,6, , , , , ,5,6,6,6, , , ,1,1,2,5,3,4, , , , , ,"167,296",14-Feb-2011 17:09:15,2,16-Feb-1960,51,7,3,8,2,2,"6,955",2
1,0,0,0,5,6,6,6, , , ,1,1,1,5,5,5, , , , , ,4,6,1,6, , , ,1,5,5,5,5,3, , , , , ,"1,634,270",14-Feb-2011 17:37:15,2,18-Sep-1952,58,7,4,8,3,5,"1,784",8
0,0,0,1,5,6,6,6, , , ,5,6,6,6,6,6, , , , , ,5,6,6,6, , , ,5,2,2,5,1,4, , , , , ,"2,027,051",21-Feb-2011 19:33:17,1,11-Mar-1949,62,6,4,7,3,5,"1,722",8
1,0,0,0,5,6,6,6, , , ,3,3,3,3,3,3, , , , , ,4,6,6,6, , , ,4,2,3,4,2,4, , , , , ,"180,503",15-Feb-2011 00:25:47,2,25-Jun-1952,58,2,8,5,6,5,"1,034",8
0,0,0,1,5,6,6,6,Interesseert me niets.,Interesseert me niets.,Interesseert me niets.,5,6,6,3,6,6,Heb geen interesse in merkkleding.,Heb geen interesse in merkkleding.,Heb 15 jaar geleden weleens iets van Nike gehad...,Heb geen interesse in merkkleding.,Heb geen interesse in merkkleding.,4,3,2,3,Geen idee.,Lijkt me leuk met de nieuwe stijl bediening.,Geen idee,3,5,4,4,2,4,"Rat, varkenskop, onbetrouwbaar uiterlijk",Naam bevalt me niet.,Onbetrouwbaar uiterlijk.,Frisse jongensachtige verschijning.,Kijkt streng; opvolger voor Rita Verdonk,"189,363",14-Feb-2011 17:05:02,1,24-Oct-1977,33,8,5,2,3,1,"3,204",12
0,0,0,1,4,2,2,2,spannend spel, ,goede spelers,3,4,2,2,1,1,"vooral comfortabel, niet spannend",iets voor pubers,goede sportkleding,"mooie, originele kleding","mooie, originele kleding",3,2,2,2,"zou willen hebben, hoor positieve berichten","heb deze zelf, vooral kinderen vinden het leuk",zelfde als bij playstation 3,3,5,6,2,2,2,Gert? niet sympathiek,ken deze meneer niet,"sympathiek, niet altijd geloofwaardig","sympathiek, komt sterk over", ,"1,875,396",14-Feb-2011 17:34:59,2,20-Dec-1969,41,7,8,2,6,6,"2,013",8
1,1,0,0,4,2,2,2, , , ,2,2,2,3,1,1, , , , , ,4,2,2,2, , , ,2,4,2,3,2,3, , , , , ,"736,285",14-Feb-2011 17:04:32,2,05-Nov-1980,30,8,5,2,4,5,"4,871",7
0,0,0,1,5,6,6,6, , , ,3,2,3,3,2,2, , , , , ,5,6,6,6, , , ,1,5,4,2,3,1, , , , , ,"131,772",16-Feb-2011 11:55:12,2,21-Mar-1949,62,7,6,2,4,5,"5,611",7
0,0,0,1,1,2,2,3, , , ,2,2,3,3,3,2, , , , , ,4,2,6,6, , , ,2,2,2,4,1,2, , , , , ,"596,980",14-Feb-2011 17:09:47,1,03-Nov-1945,65,7,7,3,5,5,"1,862",8
1,1,1,0,4,3,3,3, , , ,2,2,5,1,3,2, ,slijten bij de heren boxers heel snel in het kruis., , , ,4,6,6,6, ,lijkt me leuk om mee te trainen., ,1,3,3,3,3,4, , , , ,niet met uruzgan eens.,"636,272",14-Feb-2011 18:32:22,2,25-Nov-1962,48,3,5,2,4,5,"3,435",10
1,0,0,0,5,3,3,3, , , ,3,3,5,4,3,3,ouderwets,over the top voor niets bijzonders,slechte arbeidsomstandigheden bep.landen,"net wat duurder, maar waarom",idem,3,2,3,3, , , ,1,2,4,3,5,2, , , , , ,"2,014,470",14-Feb-2011 23:01:44,2,02-Sep-1971,39,3,8,8,6,3,"8,443",5
1,1,0,0,4,6,6,6, , , ,4,1,2,2,2,2,past altijd,goed,goed,goed,goed,5,2,1,6, ,is sportief, ,5,1,6,6,6,6,is goed voor ons land en de nederlanders, , , , ,"2,010,875",14-Feb-2011 17:04:23,2,03-Jun-1946,64,5,3,5,2,5,"4,744",7
0,0,0,1,5,6,6,6, , , ,3,6,6,6,3,2, , , , , ,5,6,6,6, , , ,4,3,3,3,3,3, , , , , ,"744,535",15-Feb-2011 08:57:07,2,27-Nov-1950,60,5,8,2,6,5,"5,554",7
1,1,1,0,2,2,3,3, , , ,2,1,1,1,2,3, , , , , ,1,1,2,3, , , ,2,5,6,2,4,4, , , , , ,"123,577",14-Feb-2011 19:21:52,2,26-Jun-1973,37,6,8,7,6,2,"1,501",8
0,0,0,1,5,3,3,3, , , ,4,6,6,6,6,6, , , , , ,4,6,6,6, , , ,4,4,6,5,3,3, , , , , ,"139,922",15-Feb-2011 13:12:30,1,29-Jun-1955,55,6,8,2,6,5,"6,141",6
